s.no	worker_id	original_tableid	original_hypothesis	original_label	modified_tableid	modified_hypothesis	modified_label
0	IA1	T829	Sergio Osme?a never served in more than one elected office.	C	T829_mod_4	Sergio Osme?a never served in more than one elected office.	E
0	IA1	T536	Denver is a city in Colorado in the United States named for James Denver.	E	T536_mod_4	Denver is a city in Colorado in the United States named for James Denver.	C
0	IA1	T839	The DC Comics Presents only came out annually.	C	T839_mod_5	The DC Comics Presents only came out annually.	E
0	IA1	T416	Johnny Depp died in car accident in early 2015.	C	T416_mod_3	Johnny Depp died in car accident in early 2015.	E
0	IA0	T1131	George Mason University's mascot is the whale.	C	T1131_mod_3	George Mason University's mascot is the whale.	E
0	IA1	T793	Colin Farrell began singing when they were 21 years old.	E	T793_mod_2	Colin Farrell began singing when they were 21 years old.	C
0	IA0	T1618	Jupiter and Io is a 16th century work of art.	E	T1618_mod_4	Jupiter and Io is a 16th century work of art.	C
0	IA1	T1668	Jerusalem is comprised of mainly Jewish people.	E	T1668_mod_2	Jerusalem is comprised of mainly Jewish people.	C
0	IA0	T361	Joaquin Phoenix is an American entertainer.	E	T361_mod_4	Joaquin Phoenix is an American entertainer.	C
0	IA0	T1612	Johann Nikolaus von Dreyse was Prussian.	C	T1612_mod_5	Johann Nikolaus von Dreyse was Prussian.	E
0	IA0	T1134	Caravan Palace does no marketing and has gained fame mainly thru word-of-mouth.	C	T1134_mod_1	Caravan Palace does no marketing and has gained fame mainly thru word-of-mouth.	E
0	IA1	T1713	John Cho has been acting for more than two and a half decades.	C	T1713_mod_4	John Cho has been acting for more than two and a half decades.	E
0	IA1	T1768	Iced Earth is not played now	C	T1768_mod_4	Iced Earth is not played now	E
0	IA0	T2032	There are ten languages spoken in Republic of Indonesia.	C	T2032_mod_5	There are ten languages spoken in Republic of Indonesia.	E
0	IA0	T928	Charlie and the Chocolate Factory was released in four countries.	C	T928_mod_4	Charlie and the Chocolate Factory was released in four countries.	E
0	IA1	T816	Curling in the XXIII Olympic Winter Games took place over 2 weeks with 3 main events.	E	T816_mod_3	Curling in the XXIII Olympic Winter Games took place over 2 weeks with 3 main events.	C
0	IA1	T1600	K?roly Zipernowsky didn't go to school to become an engineer.	C	T1600_mod_2	K?roly Zipernowsky didn't go to school to become an engineer.	E
0	IA0	T1586	Kappa Coronae Borealis b is part of the Little Dipper constellation.	C	T1586_mod_4	Kappa Coronae Borealis b is part of the Little Dipper constellation.	E
0	IA0	T790	The Cuban Revolution lasted about  years before finally ending peacefully.	C	T790_mod_4	The Cuban Revolution lasted about  years before finally ending peacefully.	E
0	IA1	T323	Czech Republic gained independence in late the 20th century.	E	T323_mod_3	Czech Republic gained independence in late the 20th century.	C
0	IA0	T554	Danehill was an American racehorse.	E	T554_mod_4	Danehill was an American racehorse.	C
0	IA0	T294	Universal Pictures released Fast & Furious in 2009.	E	T294_mod_4	Universal Pictures released Fast & Furious in 2009.	C
0	IA0	T1692	John Wayne Gacy died when they were 40.	C	T1692_mod_1	John Wayne Gacy died when they were 40.	E
0	IA0	T340	Jennifer Love Hewitt is currently a singer.	C	T340_mod_4	Jennifer Love Hewitt is currently a singer.	E
0	IA0	T12	The Faroe Islands has more than one official religion.	C	T12_mod_6	The Faroe Islands has more than one official religion.	E
0	IA0	T727	Van Dyke served in the military for WWII for over 4 years.	C	T727_mod_4	Van Dyke served in the military for WWII for over 4 years.	E
0	IA1	T1713	John Cho has been married for over ten years.	E	T1713_mod_5	John Cho has been married for over ten years.	C
0	IA1	T848	Dear White People is a TV show directed and written by Justin Simien.	E	T848_mod_1	Dear White People is a TV show directed and written by Justin Simien.	C
0	IA0	T1586	Kappa Coronae Borealis b is a few light years from Earth.	C	T1586_mod_5	Kappa Coronae Borealis b is a few light years from Earth.	E
0	IA1	T447	China has had two republic periods.	E	T447_mod_6	China has had two republic periods.	C
0	IA1	T435	The band Inearthed comes from Finland.	E	T435_mod_2	The band Inearthed comes from Finland.	C
0	IA0	T828	Common is a hip hop musician from Chicago.	E	T828_mod_2	Common is a hip hop musician from Chicago.	C
0	IA1	T261	Luoyang was the capital at the time the Eastern Jin began.	C	T261_mod_4	Luoyang was the capital at the time the Eastern Jin began.	E
0	IA1	T1369	FSU is located in Georgia.	C	T1369_mod_4	FSU is located in Georgia.	E
0	IA0	T982	Republic of Chile is a military dictatorship with representative parliament.	C	T982_mod_2	Republic of Chile is a military dictatorship with representative parliament.	E
0	IA0	T261	The reunification of China preceded the establishment of Jin.	C	T261_mod_5	The reunification of China preceded the establishment of Jin.	E
0	IA0	T1706	Jeff Lynne has been active as a musician in more than one century.	E	T1706_mod_3	Jeff Lynne has been active as a musician in more than one century.	C
0	IA0	T982	The Republic of Chile lies north of the equator.	C	T982_mod_3	The Republic of Chile lies north of the equator.	E
0	IA1	T1179	Brigadier Gerard is a British male racehorse.	E	T1179_mod_5	Brigadier Gerard is a British male racehorse.	C
0	IA0	T1544	Johnny Cash was alive during two different centuries.	E	T1544_mod_2	Johnny Cash was alive during two different centuries.	C
0	IA0	T1010	Boy Peeling Fruit is a 16th century European work of art.	E	T1010_mod_3	Boy Peeling Fruit is a 16th century European work of art.	C
0	IA1	T535	Crisis on Infinite Earths is an old American comic book series from the 80s.	E	T535_mod_1	Crisis on Infinite Earths is an old American comic book series from the 80s.	C
0	IA1	T543	Almost 1 million people watched cricket in India for the 2017 season.	C	T543_mod_3	Almost 1 million people watched cricket in India for the 2017 season.	E
0	IA1	T805	Culture was the culmination of a production collaboration between the Migos and 808God, whom produced all the songs on the album.	C	T805_mod_2	Culture was the culmination of a production collaboration between the Migos and 808God, whom produced all the songs on the album.	E
0	IA1	T1265	Brian May's scientific achievements made him famous.	C	T1265_mod_1	Brian May's scientific achievements made him famous.	E
0	IA1	T983	Camilla is part of the British Royal family.	E	T983_mod_5	Camilla is part of the British Royal family.	C
0	IA1	T1847	Jack Antonoff has performed with smaller acts.	C	T1847_mod_5	Jack Antonoff has performed with smaller acts.	E
0	IA1	T1614	There are 3 males with the same name in John Paul Getty's family.	E	T1614_mod_4	There are 3 males with the same name in John Paul Getty's family.	C
0	IA0	T286	Fan Bingbing is a Chinese entertainer.	E	T286_mod_4	Fan Bingbing is a Chinese entertainer.	C
0	IA1	T831	The Union of the Comoros was dissolved in 2009.	C	T831_mod_3	The Union of the Comoros was dissolved in 2009.	E
0	IA0	T749	Crossed is published in consistent intervals and is still an ongoing series.	C	T749_mod_3	Crossed is published in consistent intervals and is still an ongoing series.	E
0	IA1	T403	John Harrison died before the Declaration of Independence was signed.	E	T403_mod_6	John Harrison died before the Declaration of Independence was signed.	C
0	IA1	T1635	Kauto Star sired man offspring after his retirement.	C	T1635_mod_2	Kauto Star sired man offspring after his retirement.	E
0	IA1	T13	Fearless was released in the Spring of 2008.	C	T13_mod_4	Fearless was released in the Spring of 2008.	E
0	IA1	T1395	Station code BGE is managed by Northern	E	T1395_mod_4	Station code BGE is managed by Northern	C
0	IA1	T319	The Czech Republic is a multi-ethnic and multi-lingual nation.	E	T319_mod_2	The Czech Republic is a multi-ethnic and multi-lingual nation.	C
0	IA0	T1134	Caravan Palace is a French musical group.	E	T1134_mod_2	Caravan Palace is a French musical group.	C
0	IA1	T792	David Ronald de Mey Warren never went on a plane in their life.	C	T792_mod_3	David Ronald de Mey Warren never went on a plane in their life.	E
0	IA1	T1713	John Cho began his career right out of high school, skipping college.	C	T1713_mod_6	John Cho began his career right out of high school, skipping college.	E
0	IA1	T1692	John Wayne Gacy was killed by the state.	E	T1692_mod_2	John Wayne Gacy was killed by the state.	C
0	IA1	T1512	John McCain did multiple stints in office.	E	T1512_mod_2	John McCain did multiple stints in office.	C
0	IA0	T758	The bull Code Blue was originally from the United Kingdom.	C	T758_mod_1	The bull Code Blue was originally from the United Kingdom.	E
0	IA0	T1545	Jim Mattis served in the military for 44 years.	E	T1545_mod_3	Jim Mattis served in the military for 44 years.	C
0	IA1	T534	C?OC is a French vodka that comes in various flavors.	E	T534_mod_5	C?OC is a French vodka that comes in various flavors.	C
0	IA1	T1942	Jacques Charles was a European man of science.	E	T1942_mod_3	Jacques Charles was a European man of science.	C
0	IA1	T1265	Brian May is an award-winning British rock musician	E	T1265_mod_2	Brian May is an award-winning British rock musician	C
0	IA1	T1882	Jack of Fables is a comic series	E	T1882_mod_3	Jack of Fables is a comic series	C
0	IA0	T811	Collision Course is a 20th century music album.	C	T811_mod_2	Collision Course is a 20th century music album.	E
0	IA0	T1784	Interior is a painted mural.	C	T1784_mod_4	Interior is a painted mural.	E
0	IA0	T1545	Jim Mattis served in the military for over forty years.	E	T1545_mod_4	Jim Mattis served in the military for over forty years.	C
0	IA1	T839	DC Comics Presents is an ongoing series that has been publishing continuously since 1978.	C	T839_mod_6	DC Comics Presents is an ongoing series that has been publishing continuously since 1978.	E
0	IA0	T947	The Republic of Botswana is located north of the equator.	C	T947_mod_6	The Republic of Botswana is located north of the equator.	E
0	IA1	T557	Club is the most popular soft drink in the world.	C	T557_mod_3	Club is the most popular soft drink in the world.	E
0	IA0	T416	The actor Johnny Depp began acting when they were 21 years old.	E	T416_mod_4	The actor Johnny Depp began acting when they were 21 years old.	C
0	IA1	T1412	Slave Labor Graphics published at least one monthly series.	E	T1412_mod_4	Slave Labor Graphics published at least one monthly series.	C
0	IA1	T308	K?lm?n Tihanyi lived in several European countries.	E	T308_mod_3	K?lm?n Tihanyi lived in several European countries.	C
0	IA1	T729	David Byrne lived in the United Kingdom when they first became a musician.	C	T729_mod_1	David Byrne lived in the United Kingdom when they first became a musician.	E
0	IA0	T822	The city of Columbus in Georgia was founded shortly after the Civil War began.	C	T822_mod_1	The city of Columbus in Georgia was founded shortly after the Civil War began.	E
0	IA0	T1241	The Atari 2600 was discontinued 14 years after being released in Europe.	E	T1241_mod_3	The Atari 2600 was discontinued 14 years after being released in Europe.	C
0	IA0	T596	Ciara is an American entertainer married to an athlete.	E	T596_mod_3	Ciara is an American entertainer married to an athlete.	C
0	IA1	T1534	Joe Rogan began doing stand up when he was 16.	C	T1534_mod_4	Joe Rogan began doing stand up when he was 16.	E
0	IA0	T845	Dean Kamen is an American inventor from New Hampshire.	E	T845_mod_1	Dean Kamen is an American inventor from New Hampshire.	C
0	IA0	T1550	J?rgen Skafte Rasmussen was known for their business skills.	C	T1550_mod_6	J?rgen Skafte Rasmussen was known for their business skills.	E
0	IA1	T1473	The art piece Jimson Weed was made two years after Georgia O'Keeffe's death.	C	T1473_mod_3	The art piece Jimson Weed was made two years after Georgia O'Keeffe's death.	E
0	IA0	T758	Code Blue is an American Bull.	E	T758_mod_2	Code Blue is an American Bull.	C
0	IA1	T1918	Hypatia is new.	C	T1918_mod_4	Hypatia is new.	E
0	IA0	T578	Close Encounters of the Third Kind was a Hollywood film, written and directed by a famous director.	E	T578_mod_4	Close Encounters of the Third Kind was a Hollywood film, written and directed by a famous director.	C
0	IA1	T840	Dead Can Dance is an Australian musical group.	E	T840_mod_1	Dead Can Dance is an Australian musical group.	C
0	IA1	T910	Catania lies west of the prime meridian and does not recognize daily savings time.	C	T910_mod_3	Catania lies west of the prime meridian and does not recognize daily savings time.	E
0	IA0	T332	Jay Park is an American entertainer.	E	T332_mod_4	Jay Park is an American entertainer.	C
0	IA1	T405	Republic of Burundi lies north of the Equator.	C	T405_mod_5	Republic of Burundi lies north of the Equator.	E
0	IA0	T1614	John Paul Getty III died within 100 miles of his birthplace.	C	T1614_mod_5	John Paul Getty III died within 100 miles of his birthplace.	E
0	IA1	T899	Chengdu's highest elevation is over 5,000 meters.	E	T899_mod_3	Chengdu's highest elevation is over 5,000 meters.	C
0	IA0	T719	Cristiano Ronaldo is a European athlete..	E	T719_mod_5	Cristiano Ronaldo is a European athlete..	C
0	IA1	T1592	Joy is a film that didn't include any kind of music in it.	C	T1592_mod_4	Joy is a film that didn't include any kind of music in it.	E
0	IA1	T1888	City council of Huntington Beach, California includes City attorney and City treasurer.	C	T1888_mod_4	City council of Huntington Beach, California includes City attorney and City treasurer.	E
0	IA1	T1500	John Napier helped develop math concepts.	E	T1500_mod_2	John Napier helped develop math concepts.	C
0	IA1	T1148	Jamie Lynn Spears is the daughter of Britney Spears.	C	T1148_mod_4	Jamie Lynn Spears is the daughter of Britney Spears.	E
0	IA1	T709	Crack-Up is a music album recorded and released over a two-year period.	E	T709_mod_4	Crack-Up is a music album recorded and released over a two-year period.	C
0	IA1	T840	deadcandance.com is the website of an Antipodean band.	E	T840_mod_2	deadcandance.com is the website of an Antipodean band.	C
0	IA1	T1668	Population wise, is made up of about half Arab people.	C	T1668_mod_3	Population wise, is made up of about half Arab people.	E
0	IA0	T667	Crimson Peak was released to Blu-Ray in 2014.	C	T667_mod_1	Crimson Peak was released to Blu-Ray in 2014.	E
0	IA0	T733	Coca-Cola with Lime/Diet Coke with Citrus Zest has been introduced more than once.	E	T733_mod_4	Coca-Cola with Lime/Diet Coke with Citrus Zest has been introduced more than once.	C
0	IA1	T332	Jay Park began their rap career in Oakland.	C	T332_mod_5	Jay Park began their rap career in Oakland.	E
0	IA0	T1477	Kanye West is from New York City.	C	T1477_mod_3	Kanye West is from New York City.	E
0	IA1	T1847	Jack Antonoff is not anyone special.	C	T1847_mod_6	Jack Antonoff is not anyone special.	E
0	IA1	T543	India competes in cricket and has the Indian Premier League.	E	T543_mod_4	India competes in cricket and has the Indian Premier League.	C
0	IA0	T348	Christina Aguilera has released pop music under the RCA label.	E	T348_mod_3	Christina Aguilera has released pop music under the RCA label.	C
0	IA0	T535	Crisis on Infinite Earth was a DC comic that ran monthly for about a year in the 80's.	E	T535_mod_2	Crisis on Infinite Earth was a DC comic that ran monthly for about a year in the 80's.	C
0	IA1	T1182	Bradley Cooper has lived in the United Kingdom.	C	T1182_mod_3	Bradley Cooper has lived in the United Kingdom.	E
0	IA1	T578	Close Encounters of the Third Kind was inspired by another Spielberg Film, E.T., which was released before Close Encounters of the Third Kind in 1982.	C	T578_mod_5	Close Encounters of the Third Kind was inspired by another Spielberg Film, E.T., which was released before Close Encounters of the Third Kind in 1982.	E
0	IA1	T746	Some nations send multiple athletes to compete in Cross-country skiing at the Olympics.	E	T746_mod_3	Some nations send multiple athletes to compete in Cross-country skiing at the Olympics.	C
0	IA0	T1562	Jun-ichi Nishizawa graduated from multiple universities.	C	T1562_mod_4	Jun-ichi Nishizawa graduated from multiple universities.	E
0	IA0	T1875	Identity Crisis is a monthly series with an indefinite run.	C	T1875_mod_4	Identity Crisis is a monthly series with an indefinite run.	E
0	IA0	T792	David Ronald de Mey Warren lived in Austraila for over 90 years before finally passing away.	C	T792_mod_4	David Ronald de Mey Warren lived in Austraila for over 90 years before finally passing away.	E
0	IA1	T1404	Kaya Scodelario has been acting for over ten years.	C	T1404_mod_3	Kaya Scodelario has been acting for over ten years.	E
0	IA1	T758	The American Bucking Bull branded 644 has mostly dark fur.	C	T758_mod_3	The American Bucking Bull branded 644 has mostly dark fur.	E
0	IA1	T1435	Kapil Sharma is a 21st century entertainer.	E	T1435_mod_6	Kapil Sharma is a 21st century entertainer.	C
0	IA1	T323	The Czech Republic came out of Czechoslovakia.	E	T323_mod_4	The Czech Republic came out of Czechoslovakia.	C
0	IA1	T1668	The majority of the population of Jerusalem consists of Jews.	E	T1668_mod_4	The majority of the population of Jerusalem consists of Jews.	C
0	IA0	T137	The band Hawkwind started making songs in 1969.	E	T137_mod_2	The band Hawkwind started making songs in 1969.	C
0	IA0	T727	Shane Van Dyke has no great-uncles.	C	T727_mod_5	Shane Van Dyke has no great-uncles.	E
0	IA1	T370	Everclear disbanded and reunited multiple times.	C	T370_mod_4	Everclear disbanded and reunited multiple times.	E
0	IA0	T702	The City of London is a major city in the United Kingdom that has existed for almost 2000 years.	E	T702_mod_3	The City of London is a major city in the United Kingdom that has existed for almost 2000 years.	C
0	IA1	T1692	John Wayne Gacy died from natural causes.	C	T1692_mod_3	John Wayne Gacy died from natural causes.	E
0	IA1	T536	Denver, Colorado is an American city founded in the 19th century.	E	T536_mod_5	Denver, Colorado is an American city founded in the 19th century.	C
0	IA0	T1659	Jungle had two premieres in different locations during the same week.	C	T1659_mod_2	Jungle had two premieres in different locations during the same week.	E
0	IA1	T785	Ctrl was not produced by anyone who has their own studio.	C	T785_mod_4	Ctrl was not produced by anyone who has their own studio.	E
0	IA1	T544	Despicable Me 3 is a Hollywood movie.	E	T544_mod_4	Despicable Me 3 is a Hollywood movie.	C
0	IA1	T928	Tim Burton's film adaptation of Charlie and the Chocolate Factory was a commercial success.	E	T928_mod_5	Tim Burton's film adaptation of Charlie and the Chocolate Factory was a commercial success.	C
0	IA1	T1688	John Cyril Porte served in two World Wars.	C	T1688_mod_4	John Cyril Porte served in two World Wars.	E
0	IA0	T286	Fan Bingbing began recording music when they were twelve years old.	C	T286_mod_5	Fan Bingbing began recording music when they were twelve years old.	E
0	IA0	T1491	Judith and the Head of Holofernes was painted in the 1900s.	E	T1491_mod_4	Judith and the Head of Holofernes was painted in the 1900s.	C
0	IA0	T1182	Bradley Cooper has been active since his teens.	C	T1182_mod_4	Bradley Cooper has been active since his teens.	E
0	IA0	T1882	Jack of Fables is a limited series.	C	T1882_mod_4	Jack of Fables is a limited series.	E
0	IA1	T74	Katharine McPhee was born on the West Coast.	E	T74_mod_4	Katharine McPhee was born on the West Coast.	C
0	IA0	T840	The band Dead Can Dance has been on only Australian record labels.	C	T840_mod_3	The band Dead Can Dance has been on only Australian record labels.	E
0	IA0	T361	Joaquin Phoenix got married when they were 42 years old.	E	T361_mod_5	Joaquin Phoenix got married when they were 42 years old.	C
0	IA0	T1473	Jimson Weed is a work of art created by a woman.	E	T1473_mod_4	Jimson Weed is a work of art created by a woman.	C
0	IA1	T1241	Atari 2600 is an American video game console.	E	T1241_mod_4	Atari 2600 is an American video game console.	C
0	IA1	T1598	Judy was a commissioned officer while in the Royal Navy.	C	T1598_mod_1	Judy was a commissioned officer while in the Royal Navy.	E
0	IA1	T1545	Jim Mattis was in the US military.	E	T1545_mod_5	Jim Mattis was in the US military.	C
0	IA1	T1311	The Royal Society of Edinburgh has its origings in 1737 and is found in Scotland.	E	T1311_mod_4	The Royal Society of Edinburgh has its origings in 1737 and is found in Scotland.	C
0	IA0	T1179	Brigadier Gerard was a British Thoroughbred racehorse and sire, foaled in 1968.	E	T1179_mod_6	Brigadier Gerard was a British Thoroughbred racehorse and sire, foaled in 1968.	C
0	IA1	T261	Jin was a region in China for over 300 years.	E	T261_mod_6	Jin was a region in China for over 300 years.	C
0	IA1	T840	Dead Can Dance is a defunct band from the 19th century.	C	T840_mod_4	Dead Can Dance is a defunct band from the 19th century.	E
0	IA1	T1440	Keeping Up with the Joneses was a low-budget independent movie.	C	T1440_mod_6	Keeping Up with the Joneses was a low-budget independent movie.	E
0	IA0	T845	Dean Kamen wound up working for a large company.	C	T845_mod_2	Dean Kamen wound up working for a large company.	E
0	IA0	T1626	Jim Croce is a singer who lived a very short life.	E	T1626_mod_1	Jim Croce is a singer who lived a very short life.	C
0	IA0	T1601	Jimmy Eat World have largely been loyal to their original label.	C	T1601_mod_5	Jimmy Eat World have largely been loyal to their original label.	E
0	IA0	T1182	Bradley Cooper is an award-winning American actor.	E	T1182_mod_5	Bradley Cooper is an award-winning American actor.	C
0	IA1	T727	Arlene Silver's husband was born in the twenties.	E	T727_mod_6	Arlene Silver's husband was born in the twenties.	C
0	IA0	T137	The band Hawkwind is known for performing with Motley Crue.	C	T137_mod_3	The band Hawkwind is known for performing with Motley Crue.	E
0	IA1	T2028	Hot Fuzz runs for under two years.	C	T2028_mod_5	Hot Fuzz runs for under two years.	E
0	IA0	T1031	Case Closed is a Japanese comic serial.	E	T1031_mod_3	Case Closed is a Japanese comic serial.	C
0	IA1	T848	The writer of Dear White People was also one of its producers.	E	T848_mod_2	The writer of Dear White People was also one of its producers.	C
0	IA1	T729	Byrne retired from music in 1989 to work on his farm.	C	T729_mod_2	Byrne retired from music in 1989 to work on his farm.	E
0	IA0	T1580	Kate Hudson was most recently married to Matthew.	C	T1580_mod_4	Kate Hudson was most recently married to Matthew.	E
0	IA1	T340	Jennifer Love Hewitt is an American entertainer.	E	T340_mod_5	Jennifer Love Hewitt is an American entertainer.	C
0	IA1	T1819	Hugo was originally in French.	C	T1819_mod_5	Hugo was originally in French.	E
0	IA1	T910	Catania is does no marketing to potential visitors.	C	T910_mod_4	Catania is does no marketing to potential visitors.	E
0	IA0	T733	Coca-Cola with Lime was introduced in Northern Ireland before being made in the U.K.	C	T733_mod_5	Coca-Cola with Lime was introduced in Northern Ireland before being made in the U.K.	E
0	IA1	T29	Bullet for My Valentine has only released music for RCA records.	C	T29_mod_5	Bullet for My Valentine has only released music for RCA records.	E
0	IA1	T910	Catania is a small sized Christian city.	E	T910_mod_5	Catania is a small sized Christian city.	C
0	IA1	T702	City of London is a unique area of England.	E	T702_mod_4	City of London is a unique area of England.	C
0	IA0	T544	Despicable Me 3 is an animated movie distributed by Universal Pictures in 2017.	E	T544_mod_5	Despicable Me 3 is an animated movie distributed by Universal Pictures in 2017.	C
0	IA1	T1002	Catalonia is mostly communist in nature and does not have republic representation.	C	T1002_mod_5	Catalonia is mostly communist in nature and does not have republic representation.	E
0	IA0	T2028	Hot Fuzz was released in three different countries in the same year.	E	T2028_mod_6	Hot Fuzz was released in three different countries in the same year.	C
0	IA1	T1512	John McCain served multiple times in office during the 20th century.	C	T1512_mod_3	John McCain served multiple times in office during the 20th century.	E
0	IA1	T785	Ctrl is an R&B album distributed by Top Dawg Entermtainment in 2017.	E	T785_mod_5	Ctrl is an R&B album distributed by Top Dawg Entermtainment in 2017.	C
0	IA0	T797	Cue Card is a castrated British racehorse.	E	T797_mod_5	Cue Card is a castrated British racehorse.	C
0	IA0	T1875	Identity Crisis was only ran in one year.	E	T1875_mod_5	Identity Crisis was only ran in one year.	C
0	IA1	T405	The majority of people in the Republic of Burundi are Hindus.	E	T405_mod_6	The majority of people in the Republic of Burundi are Hindus.	C
0	IA0	T1534	Joe Rogan has been performing comedy for over thirty years.	E	T1534_mod_5	Joe Rogan has been performing comedy for over thirty years.	C
0	IA0	T791	Colectiv nightclub fire was a negligent fire in Europe that resulted in many deaths.	E	T791_mod_2	Colectiv nightclub fire was a negligent fire in Europe that resulted in many deaths.	C
0	IA0	T1311	Royal Society of Edinburgh was formed to promote British royalty.	C	T1311_mod_5	Royal Society of Edinburgh was formed to promote British royalty.	E
0	IA1	T1518	Jurassic Park was a novel turned Hollywood film.	E	T1518_mod_5	Jurassic Park was a novel turned Hollywood film.	C
0	IA1	T688	Dennis Gabor received the Nobel Peace Prize while working for Oxford in 1982.	C	T688_mod_4	Dennis Gabor received the Nobel Peace Prize while working for Oxford in 1982.	E
0	IA0	T146	Beau Bridges mother is Susan Geston.	C	T146_mod_1	Beau Bridges mother is Susan Geston.	E
0	IA0	T845	Dean won the Hoover medal for his work on the Segway in the mid 2000's.	C	T845_mod_3	Dean won the Hoover medal for his work on the Segway in the mid 2000's.	E
0	IA0	T741	David Duchovny has been acting since the 1960s.	C	T741_mod_4	David Duchovny has been acting since the 1960s.	E
