s.no	worker_id	original_tableid	original_hypothesis	original_label	modified_tableid	modified_hypothesis	modified_label
0	IA1	T846	Dean Martin is a musician from Ohio known for his singing and acting.	E	T846_mod_2	Dean Martin is a musician from Ohio known for his singing and acting.	C
0	IA0	T885	Caracas is a city well above sea level.	E	T885_mod_4	Caracas is a city well above sea level.	C
0	IA1	T1688	John Cyril Porte served over two decades in the military.	C	T1688_mod_5	John Cyril Porte served over two decades in the military.	E
0	IA1	T667	Crimson Peak is 21st century American independent film.	E	T667_mod_2	Crimson Peak is 21st century American independent film.	C
0	IA0	T749	The next issue of the Crossed series will be released in June 2019.	C	T749_mod_4	The next issue of the Crossed series will be released in June 2019.	E
0	IA1	T1164	The Romanian Football of the Year award is only twenty years old.	C	T1164_mod_5	The Romanian Football of the Year award is only twenty years old.	E
0	IA1	T382	Jeff Hardy is an American entertainer.	E	T382_mod_4	Jeff Hardy is an American entertainer.	C
0	IA0	T1635	Kauto Star was a French male racehorse	E	T1635_mod_3	Kauto Star was a French male racehorse	C
0	IA1	T458	Contract bridge is a multi-player card game.	E	T458_mod_4	Contract bridge is a multi-player card game.	C
0	IA0	T738	The Cockerel FabergŽ egg has a bird inside of it.	E	T738_mod_4	The Cockerel FabergŽ egg has a bird inside of it.	C
0	IA1	T799	Kaepernick has scored 74 total touchdowns in his NFL career.	C	T799_mod_5	Kaepernick has scored 74 total touchdowns in his NFL career.	E
0	IA0	T1443	Karachi is a small village governed by village elders.	C	T1443_mod_4	Karachi is a small village governed by village elders.	E
0	IA1	T1412	Johnny the Homicidal Maniac came out every week when it was produced.	C	T1412_mod_5	Johnny the Homicidal Maniac came out every week when it was produced.	E
0	IA1	T152	Jane Austen passed away when she was 45.	C	T152_mod_5	Jane Austen passed away when she was 45.	E
0	IA0	T20	The rappers Flatbush Zombies are known for performing with rock bands.	C	T20_mod_6	The rappers Flatbush Zombies are known for performing with rock bands.	E
0	IA1	T272	Gerry Mulligan is associated with Chesney Henry Baker.	E	T272_mod_4	Gerry Mulligan is associated with Chesney Henry Baker.	C
0	IA1	T1047	Changsha is a city in China.	E	T1047_mod_2	Changsha is a city in China.	C
0	IA1	T790	The Republic of Cuba took 30 years to be recognized as independent.	E	T790_mod_5	The Republic of Cuba took 30 years to be recognized as independent.	C
0	IA1	T1730	Jon Hamm graduated from college.	E	T1730_mod_3	Jon Hamm graduated from college.	C
0	IA0	T319	The government in Prague's official language is German.	C	T319_mod_3	The government in Prague's official language is German.	E
0	IA1	T535	Crisis on Infinite Earths was a novel released in the winter of 1985.	C	T535_mod_3	Crisis on Infinite Earths was a novel released in the winter of 1985.	E
0	IA0	T1668	Christians comprise a big part of the population of Jerusalem.	C	T1668_mod_5	Christians comprise a big part of the population of Jerusalem.	E
0	IA0	T1668	Half of the population of Jerusalem is Arab.	C	T1668_mod_6	Half of the population of Jerusalem is Arab.	E
0	IA0	T1942	Jacques Charles was a physicist known primarily for his groundbreaking Charles's law	E	T1942_mod_4	Jacques Charles was a physicist known primarily for his groundbreaking Charles's law	C
0	IA1	T1464	The Nobel Prize was awarded to John James Rickard Macleod, FRS while in his twenties.	C	T1464_mod_4	The Nobel Prize was awarded to John James Rickard Macleod, FRS while in his twenties.	E
0	IA1	T974	Chicago, Illinois is a city with tiny water resources.relative to its land mass.	E	T974_mod_3	Chicago, Illinois is a city with tiny water resources.relative to its land mass.	C
0	IA0	T805	Culture is a hip-hop album that was released in 2017.	E	T805_mod_3	Culture is a hip-hop album that was released in 2017.	C
0	IA0	T1182	The winter of 1975 was when Bradley Cooper, the actor, was born.	E	T1182_mod_6	The winter of 1975 was when Bradley Cooper, the actor, was born.	C
0	IA0	T1131	George Mason University has more postgraduates than undergraduates.	C	T1131_mod_4	George Mason University has more postgraduates than undergraduates.	E
0	IA0	T680	Camp Kill Yourself has been on more labels than they have associated acts.	C	T680_mod_4	Camp Kill Yourself has been on more labels than they have associated acts.	E
0	IA1	T761	Code Orange is an American punk band.	E	T761_mod_5	Code Orange is an American punk band.	C
0	IA0	T1404	The last decade of the 20th century is when Kaya Scodelario was born.	E	T1404_mod_4	The last decade of the 20th century is when Kaya Scodelario was born.	C
0	IA1	T1404	Kaya Scodelario has no children.	C	T1404_mod_5	Kaya Scodelario has no children.	E
0	IA0	T1664	Jessie J is an English singer.	E	T1664_mod_6	Jessie J is an English singer.	C
0	IA0	T1446	The Fall of 1969 is when Jennifer Aniston was born.	C	T1446_mod_3	The Fall of 1969 is when Jennifer Aniston was born.	E
0	IA0	T1500	John Napier did not attend college.	C	T1500_mod_3	John Napier did not attend college.	E
0	IA0	T1702	Kas is a Spanish soft drink.	E	T1702_mod_4	Kas is a Spanish soft drink.	C
0	IA0	T1500	John Napier was born and died in the same country.	E	T1500_mod_4	John Napier was born and died in the same country.	C
0	IA0	T274	Fawad Khan is a Pakistani entertainer.	E	T274_mod_2	Fawad Khan is a Pakistani entertainer.	C
0	IA0	T1544	Johnny Cash had two wives.	E	T1544_mod_3	Johnny Cash had two wives.	C
0	IA0	T1544	Johnny Cash uses the same name that he was born with.	C	T1544_mod_4	Johnny Cash uses the same name that he was born with.	E
0	IA0	T816	Curling in the 2018 Winter Olympics saw under 100 men and women compete over 4 weeks.	C	T816_mod_4	Curling in the 2018 Winter Olympics saw under 100 men and women compete over 4 weeks.	E
0	IA0	T1692	John Wayne Gacy died more than ten years after being convicted.	E	T1692_mod_4	John Wayne Gacy died more than ten years after being convicted.	C
0	IA0	T846	Leonard Barr's nephew was active for over half a century.	E	T846_mod_3	Leonard Barr's nephew was active for over half a century.	C
0	IA0	T1692	He got a divorce after he was convicted.	C	T1692_mod_5	He got a divorce after he was convicted.	E
0	IA0	T1241	Atary 2600 had 64 bytes RAM and 16-bit MOS Technology 6507 @ 1.19 MHz.	C	T1241_mod_5	Atary 2600 had 64 bytes RAM and 16-bit MOS Technology 6507 @ 1.19 MHz.	E
0	IA0	T1784	Interior is currently in an American museum.	E	T1784_mod_5	Interior is currently in an American museum.	C
0	IA1	T1635	Kauto Star passed away when they were ten years old.	C	T1635_mod_4	Kauto Star passed away when they were ten years old.	E
0	IA1	T1888	Huntington Beach, California's city clerk is Robin Estanislau	E	T1888_mod_5	Huntington Beach, California's city clerk is Robin Estanislau	C
0	IA0	T790	The Republic of Cuba was a former Spanish and American colony before 1900.	E	T790_mod_6	The Republic of Cuba was a former Spanish and American colony before 1900.	C
0	IA1	T272	Chet Baker was an American musician.	E	T272_mod_5	Chet Baker was an American musician.	C
0	IA0	T1598	Judy was active as a ship's mascot for over a dozen years.	E	T1598_mod_2	Judy was active as a ship's mascot for over a dozen years.	C
0	IA0	T1768	Iced Earth also had two other names.	E	T1768_mod_5	Iced Earth also had two other names.	C
0	IA0	T1690	Jinder Mahal has been known by multiple ring names.	E	T1690_mod_4	Jinder Mahal has been known by multiple ring names.	C
0	IA0	T1690	Jinder Mahal weighs more in kilos than his total height in centimeters.	C	T1690_mod_5	Jinder Mahal weighs more in kilos than his total height in centimeters.	E
0	IA0	T435	The band formerly known as Inearthed has been on four labels.	C	T435_mod_3	The band formerly known as Inearthed has been on four labels.	E
0	IA0	T1882	it is still being produced today	C	T1882_mod_5	it is still being produced today	E
0	IA1	T1444	Kasabian has been performing for over 20 years.	E	T1444_mod_3	Kasabian has been performing for over 20 years.	C
0	IA1	T822	Columbus is a city in Georgia named after Christopher Columbus.	E	T822_mod_2	Columbus is a city in Georgia named after Christopher Columbus.	C
0	IA0	T1444	Kasabian is an English rock band.	E	T1444_mod_4	Kasabian is an English rock band.	C
0	IA0	T331	The musician Bryan Adams spent the majority of his life in the United States.	C	T331_mod_1	The musician Bryan Adams spent the majority of his life in the United States.	E
0	IA0	T13	The album Fearless was released in the winter of 2008.	E	T13_mod_5	The album Fearless was released in the winter of 2008.	C
0	IA0	T13	Scott Borchetta single-handily produced Fearless.	C	T13_mod_6	Scott Borchetta single-handily produced Fearless.	E
0	IA0	T400	Jordan Peele has been active since his teens.	C	T400_mod_2	Jordan Peele has been active since his teens.	E
0	IA0	T422	Jerry Lee Lewis has done a greater number of genres than associated acts.	C	T422_mod_2	Jerry Lee Lewis has done a greater number of genres than associated acts.	E
0	IA0	T1265	Brian May married Anita Dobson at the age of 53.	E	T1265_mod_3	Brian May married Anita Dobson at the age of 53.	C
0	IA1	T845	Dean Kamen has won over five major awards.	E	T845_mod_4	Dean Kamen has won over five major awards.	C
0	IA0	T1449	Kareem Abdul-Jabbar played as a center for thirty years.	E	T1449_mod_3	Kareem Abdul-Jabbar played as a center for thirty years.	C
0	IA0	T1534	Joe Rogan's career has been going strong for more than 30 years.	E	T1534_mod_6	Joe Rogan's career has been going strong for more than 30 years.	C
0	IA1	T400	Jordan Peele is an American entertainer.	E	T400_mod_3	Jordan Peele is an American entertainer.	C
0	IA0	T596	Ciara Princess Harris born on  October 25, 1985 at  Austin, Texas, U.S.	E	T596_mod_4	Ciara Princess Harris born on  October 25, 1985 at  Austin, Texas, U.S.	C
0	IA0	T749	Crossed was a limited series published for about 2 and a half years by Avatar Press.	E	T749_mod_5	Crossed was a limited series published for about 2 and a half years by Avatar Press.	C
0	IA1	T746	Cross-country skiing at the XXIII Olympic Winter Games had mens and women's races.	E	T746_mod_4	Cross-country skiing at the XXIII Olympic Winter Games had mens and women's races.	C
0	IA1	T746	More than 500 people competed in Cross-country skiing at the XXIII Olympic Winter Games.	C	T746_mod_5	More than 500 people competed in Cross-country skiing at the XXIII Olympic Winter Games.	E
0	IA0	T1626	Jim Croce, also known as James Joseph Croce, is a singer and songwriter.	E	T1626_mod_2	Jim Croce, also known as James Joseph Croce, is a singer and songwriter.	C
0	IA0	T720	The album David Bowie was over an hour in length.	C	T720_mod_5	The album David Bowie was over an hour in length.	E
0	IA0	T846	Dean Martin had 8 children all with one woman.	C	T846_mod_4	Dean Martin had 8 children all with one woman.	E
0	IA0	T720	David Bowie's self-titled album was released more than a half a year after it was finished recording.	C	T720_mod_6	David Bowie's self-titled album was released more than a half a year after it was finished recording.	E
0	IA1	T1436	Kate Micucci went to college in the same state they were born in.	C	T1436_mod_4	Kate Micucci went to college in the same state they were born in.	E
0	IA0	T1047	Changsha is in the top twenty largest cities in China.	E	T1047_mod_3	Changsha is in the top twenty largest cities in China.	C
0	IA0	T1598	Judy was a Pointer dog that was also a mascot for the Royal Navy.	E	T1598_mod_3	Judy was a Pointer dog that was also a mascot for the Royal Navy.	C
0	IA0	T535	The first issue of Crisis on Infinite Earths was released in spring of 1985.	E	T535_mod_4	The first issue of Crisis on Infinite Earths was released in spring of 1985.	C
0	IA1	T372	Florence Lawrence married Charles Woodring after divorcing Henry Bolton.	C	T372_mod_3	Florence Lawrence married Charles Woodring after divorcing Henry Bolton.	E
0	IA0	T274	Fawad Khan married his spouse before he became active in the entertainment industry.	C	T274_mod_3	Fawad Khan married his spouse before he became active in the entertainment industry.	E
0	IA0	T372	Florence Annie Bridgwood committed suicide in 1938.	E	T372_mod_4	Florence Annie Bridgwood committed suicide in 1938.	C
0	IA0	T1404	Kaya Scodelario began acting when they were 15.	E	T1404_mod_6	Kaya Scodelario began acting when they were 15.	C
0	IA0	T294	The movie Fast & Furious made over $250 million at the box office.	E	T294_mod_5	The movie Fast & Furious made over $250 million at the box office.	C
0	IA0	T104	The E Street Band was formed on the east coast of the USA.	E	T104_mod_6	The E Street Band was formed on the east coast of the USA.	C
0	IA1	T910	The patron saint of Catania is a woman.	E	T910_mod_6	The patron saint of Catania is a woman.	C
0	IA0	T1491	Judith and the Head of Holofernes is done in charcoal.	C	T1491_mod_5	Judith and the Head of Holofernes is done in charcoal.	E
0	IA1	T319	There are more Moravians than Slovaks in the Czech Republic.	E	T319_mod_4	There are more Moravians than Slovaks in the Czech Republic.	C
0	IA0	T811	Collision Course took 3 months to record before being released in early 2004.	C	T811_mod_3	Collision Course took 3 months to record before being released in early 2004.	E
0	IA1	T372	Florence Lawrence was responsible for her own death.	E	T372_mod_5	Florence Lawrence was responsible for her own death.	C
0	IA0	T14	Flatliners was released in the winter of 1990.	C	T14_mod_4	Flatliners was released in the winter of 1990.	E
0	IA0	T535	Crisis on Infinite Earth's main character was Batman, whom gets killed by Dumbledore in the last issue.	C	T535_mod_5	Crisis on Infinite Earth's main character was Batman, whom gets killed by Dumbledore in the last issue.	E
0	IA0	T1444	Kasabian is a band from the US.	C	T1444_mod_5	Kasabian is a band from the US.	E
0	IA0	T14	Flatliners made 50 million over it's budget at the box office.	C	T14_mod_5	Flatliners made 50 million over it's budget at the box office.	E
0	IA0	T1635	Kauto Star won over half the races it ran.	E	T1635_mod_5	Kauto Star won over half the races it ran.	C
0	IA0	T14	Flatliners made over double what it cost to make at the box office.	E	T14_mod_6	Flatliners made over double what it cost to make at the box office.	C
0	IA1	T1635	Kauto Star was able to win the majority of their races.	E	T1635_mod_6	Kauto Star was able to win the majority of their races.	C
0	IA0	T137	Hawkwind has been performing for over 40 years.	E	T137_mod_4	Hawkwind has been performing for over 40 years.	C
0	IA0	T277	Charo has been married twice in her life.	E	T277_mod_2	Charo has been married twice in her life.	C
0	IA0	T137	Hawkwind are a North American band.	C	T137_mod_5	Hawkwind are a North American band.	E
0	IA0	T137	Hawkwind has been active as a band for about 50 years.	E	T137_mod_6	Hawkwind has been active as a band for about 50 years.	C
0	IA0	T277	Charo's career has spanned eight decades.	C	T277_mod_3	Charo's career has spanned eight decades.	E
0	IA0	T274	Fawad Khan was signed to Lips Music when he married Sadaf Khan.	E	T274_mod_4	Fawad Khan was signed to Lips Music when he married Sadaf Khan.	C
0	IA0	T277	Charo has never had any children.	C	T277_mod_4	Charo has never had any children.	E
0	IA1	T323	Czech Republic separated from the Austria-Hungary Empire over 100 years ago.	E	T323_mod_5	Czech Republic separated from the Austria-Hungary Empire over 100 years ago.	C
0	IA0	T294	Fast & Furious was written and directed by the same person.	C	T294_mod_6	Fast & Furious was written and directed by the same person.	E
0	IA0	T433	The movie Concussion was written and directed by the same person.	E	T433_mod_3	The movie Concussion was written and directed by the same person.	C
0	IA1	T422	Jerry Lee Lewis is an American entertainer.	E	T422_mod_3	Jerry Lee Lewis is an American entertainer.	C
0	IA1	T433	Concussion came out in the United States before being shown at AFI fest.	C	T433_mod_4	Concussion came out in the United States before being shown at AFI fest.	E
0	IA0	T1047	Changsha has more people in its urban area than in its metro area.	C	T1047_mod_4	Changsha has more people in its urban area than in its metro area.	E
0	IA0	T791	More than 50 people passed away at the Colectiv nightclub fire.	E	T791_mod_3	More than 50 people passed away at the Colectiv nightclub fire.	C
0	IA0	T1690	Jinder Mahal is above average in height and in weight for most human beings.	E	T1690_mod_6	Jinder Mahal is above average in height and in weight for most human beings.	C
0	IA1	T982	The Rep?blica de Chile has three houses in its legislature.	C	T982_mod_4	The Rep?blica de Chile has three houses in its legislature.	E
0	IA0	T816	Curling at the Gangneug Gymnasium during the Olympics had no women's events.	C	T816_mod_5	Curling at the Gangneug Gymnasium during the Olympics had no women's events.	E
0	IA0	T1656	Karen Gillan studied acting at the Italia Conti Academy of Theatre Arts and has been acting since 2006.	E	T1656_mod_5	Karen Gillan studied acting at the Italia Conti Academy of Theatre Arts and has been acting since 2006.	C
0	IA0	T816	There were over 150 countries involved.	C	T816_mod_6	There were over 150 countries involved.	E
0	IA1	T974	Chicago's lowest elevation and average elevation differ by more than 16 feet.	C	T974_mod_4	Chicago's lowest elevation and average elevation differ by more than 16 feet.	E
0	IA0	T554	Danehill never lost a horserace in its entire career.	C	T554_mod_5	Danehill never lost a horserace in its entire career.	E
0	IA0	T1131	George Mason University has been operating for the past 68 years.	E	T1131_mod_5	George Mason University has been operating for the past 68 years.	C
0	IA0	T734	David Cook is known for making video games.	E	T734_mod_5	David Cook is known for making video games.	C
0	IA0	T1131	George Mason University has more than 35,000 students.	E	T1131_mod_6	George Mason University has more than 35,000 students.	C
0	IA1	T794	David with the Head of Goliath is a small painting, measuring just a foot tall and 2 feet wide.	C	T794_mod_5	David with the Head of Goliath is a small painting, measuring just a foot tall and 2 feet wide.	E
0	IA0	T1446	Jennifer Aniston went to school in New York.	E	T1446_mod_4	Jennifer Aniston went to school in New York.	C
0	IA1	T1446	Jennifer Aniston's career has spanned more than three decades thus far.	E	T1446_mod_5	Jennifer Aniston's career has spanned more than three decades thus far.	C
0	IA0	T1508	Josta was first made in the last 10 years of the 20th century.	E	T1508_mod_5	Josta was first made in the last 10 years of the 20th century.	C
0	IA0	T1500	The Summer of 1617 was when John Napier died.	C	T1500_mod_5	The Summer of 1617 was when John Napier died.	E
0	IA1	T1706	Jeff Lynne went by several different names.	E	T1706_mod_4	Jeff Lynne went by several different names.	C
0	IA0	T1544	Johnny Cash was an only child.	C	T1544_mod_5	Johnny Cash was an only child.	E
0	IA1	T1706	Jeff Lynne has had more than one stage name.	E	T1706_mod_5	Jeff Lynne has had more than one stage name.	C
0	IA1	T1544	Johnny Cash had a career that spanned across more than five decades.	C	T1544_mod_6	Johnny Cash had a career that spanned across more than five decades.	E
0	IA0	T1598	Judy died in the Fall of 1950.	C	T1598_mod_4	Judy died in the Fall of 1950.	E
0	IA1	T319	The Czech Republic is comprised of mainly Slovaks and muslims.	C	T319_mod_5	The Czech Republic is comprised of mainly Slovaks and muslims.	E
0	IA1	T1692	John Wayne Gacy was not married when he was 29 years old.	E	T1692_mod_6	John Wayne Gacy was not married when he was 29 years old.	C
0	IA0	T422	Jerry Lee Lewis has been performing music for over fifty years.	E	T422_mod_4	Jerry Lee Lewis has been performing music for over fifty years.	C
0	IA1	T535	Crisis on Infinite Earths celebrates its 35th year anniversary since publication.	C	T535_mod_6	Crisis on Infinite Earths celebrates its 35th year anniversary since publication.	E
0	IA1	T746	The Cross-country skiing event at the XXIII Olympics ran for over 3 weeks and featured hundreds of competitors from over 70 countries.	C	T746_mod_6	The Cross-country skiing event at the XXIII Olympics ran for over 3 weeks and featured hundreds of competitors from over 70 countries.	E
0	IA1	T17	Bryce Dallas Howard has 3 sons.	C	T17_mod_3	Bryce Dallas Howard has 3 sons.	E
0	IA1	T146	Jeff Bridges was born in the winter of 1949.	E	T146_mod_2	Jeff Bridges was born in the winter of 1949.	C
0	IA1	T1491	Judith and the Head of Holofernes is a 20th century work of art.	E	T1491_mod_6	Judith and the Head of Holofernes is a 20th century work of art.	C
0	IA0	T277	Mar’a del Rosario Mercedes Pilar Mart’nez Molina Baeza was married before becoming 'active' in her careers.	C	T277_mod_5	Mar’a del Rosario Mercedes Pilar Mart’nez Molina Baeza was married before becoming 'active' in her careers.	E
0	IA1	T1592	The film Joy was released by Disney.	C	T1592_mod_5	The film Joy was released by Disney.	E
0	IA1	T331	Bryan Adams is a Canadian Pop Singer.	E	T331_mod_2	Bryan Adams is a Canadian Pop Singer.	C
0	IA1	T1768	Iced Earth stopped performing in the 1990s.	C	T1768_mod_6	Iced Earth stopped performing in the 1990s.	E
0	IA0	T400	Jordan Haworth Peele was educated at Sarah Lawrence College.	E	T400_mod_4	Jordan Haworth Peele was educated at Sarah Lawrence College.	C
0	IA1	T207	Burn Energy was made by the same company that makes Monster.	E	T207_mod_5	Burn Energy was made by the same company that makes Monster.	C
0	IA1	T543	India faced Pakistan in a five day match in 1999.	E	T543_mod_5	India faced Pakistan in a five day match in 1999.	C
0	IA0	T741	David Duchovny went to college in the USA.	E	T741_mod_5	David Duchovny went to college in the USA.	C
0	IA0	T667	Crimson Peak made $19.7 million in profit after it's box office run completed.	E	T667_mod_3	Crimson Peak made $19.7 million in profit after it's box office run completed.	C
0	IA1	T207	Burn energy came in a chocolate flavor.	C	T207_mod_6	Burn energy came in a chocolate flavor.	E
0	IA1	T667	Crimson Peak made a significant profit at the box office.	C	T667_mod_4	Crimson Peak made a significant profit at the box office.	E
0	IA1	T491	Cory Monteith started as a teenage actor.	C	T491_mod_3	Cory Monteith started as a teenage actor.	E
0	IA0	T729	David Byrne moved to the United States.	E	T729_mod_3	David Byrne moved to the United States.	C
0	IA0	T758	The bull Code Blue weighed under a ton.	E	T758_mod_4	The bull Code Blue weighed under a ton.	C
0	IA0	T1031	Case Closed ran for 6 months before the publication ceased.	C	T1031_mod_4	Case Closed ran for 6 months before the publication ceased.	E
0	IA0	T1477	Kanye West was born in the same state in which he now lives.	C	T1477_mod_4	Kanye West was born in the same state in which he now lives.	E
0	IA0	T822	Columbus, Georgia was founded in the second half of the nineteenth century.	C	T822_mod_3	Columbus, Georgia was founded in the second half of the nineteenth century.	E
0	IA1	T1626	Jim Croce was 56 when he died.	C	T1626_mod_3	Jim Croce was 56 when he died.	E
0	IA0	T848	Dear White People wound up losing money at the box office.	C	T848_mod_3	Dear White People wound up losing money at the box office.	E
0	IA0	T749	The comic Crossed was a super hero comic.	C	T749_mod_6	The comic Crossed was a super hero comic.	E
0	IA1	T848	Dear White People premiered at Sundance after its U.S. premier.	C	T848_mod_4	Dear White People premiered at Sundance after its U.S. premier.	E
0	IA0	T791	Colectiv nightclub fire raged for hours and destroyed other businesses.	C	T791_mod_4	Colectiv nightclub fire raged for hours and destroyed other businesses.	E
0	IA0	T1134	Caravan Palace is located in Paris, France and is active from 2008.	E	T1134_mod_3	Caravan Palace is located in Paris, France and is active from 2008.	C
0	IA0	T286	Fˆn B_ngb_ng was born in 1981.	E	T286_mod_6	Fˆn B_ngb_ng was born in 1981.	C
0	IA0	T1265	Brian May has been active for over 50 years.	E	T1265_mod_4	Brian May has been active for over 50 years.	C
0	IA1	T332	Jay Park has been a musician since they were 21 years old.	E	T332_mod_6	Jay Park has been a musician since they were 21 years old.	C
0	IA1	T1406	Kazakh Khanate has had more than six different Capitals.	C	T1406_mod_2	Kazakh Khanate has had more than six different Capitals.	E
0	IA1	T793	Colin Farrell has an uncle with the same last name as him.	C	T793_mod_3	Colin Farrell has an uncle with the same last name as him.	E
0	IA0	T1406	Kazakh Khanate had the capital moved several times.	E	T1406_mod_3	Kazakh Khanate had the capital moved several times.	C
0	IA1	T828	Lonnie Corant Jaman Shuka collaborated with at least one known rapper.	E	T828_mod_3	Lonnie Corant Jaman Shuka collaborated with at least one known rapper.	C
0	IA0	T1449	Kareem Abdul-Jabbar was a first round pick for basketball.	E	T1449_mod_4	Kareem Abdul-Jabbar was a first round pick for basketball.	C
0	IA0	T828	Lonnie Corant Jaman Shuka never worked wirh R'n'B artists.	C	T828_mod_4	Lonnie Corant Jaman Shuka never worked wirh R'n'B artists.	E
0	IA0	T1449	Kareem Abdul-Jabbar went to college in the 1960s.	E	T1449_mod_5	Kareem Abdul-Jabbar went to college in the 1960s.	C
0	IA1	T1502	Karl Ferdinand Braun died in the same century that he was born in.	C	T1502_mod_1	Karl Ferdinand Braun died in the same century that he was born in.	E
0	IA0	T885	Caracas lowest point is below sea level.	C	T885_mod_5	Caracas lowest point is below sea level.	E
0	IA0	T1600	K?roly Zipernowsky was born as Carl Zipernowsky in 1853.	E	T1600_mod_3	K?roly Zipernowsky was born as Carl Zipernowsky in 1853.	C
0	IA0	T1148	Britney Spears is an American singer songwriter.	E	T1148_mod_5	Britney Spears is an American singer songwriter.	C
0	IA0	T1600	K?roly Zipernowsky died where he was born.	C	T1600_mod_4	K?roly Zipernowsky died where he was born.	E
