s.no	worker_id	original_tableid	original_hypothesis	original_label	modified_tableid	modified_hypothesis	modified_label
0	IA0	T440	The Republic of Chile President is a woman.	C	T440_mod_4	The Republic of Chile President is a woman.	E
0	IA0	T74	Katharine McPhee has been with over 7 record labels.	C	T74_mod_3	Katharine McPhee has been with over 7 record labels.	E
0	IA0	T261	The Jin dynasty capital moved around to different cities.	E	T261_mod_2	The Jin dynasty capital moved around to different cities.	C
0	IA1	T761	Code Orange is an American punk and metalcore band.	E	T761_mod_4	Code Orange is an American punk and metalcore band.	C
0	IA0	T310	Christchurch is made up of wards and governed by a council.	E	T310_mod_1	Christchurch is made up of wards and governed by a council.	C
0	IA0	T416	Johnny Depp has been married twice.	E	T416_mod_2	Johnny Depp has been married twice.	C
0	IA0	T885	Caracas' metro area is more than ten times its city size.	E	T885_mod_1	Caracas' metro area is more than ten times its city size.	C
0	IA0	T534	C?OC is a two-decade old brand.	C	T534_mod_3	C?OC is a two-decade old brand.	E
0	IA0	T1148	Britney Spears was born and raised in the midwest.	C	T1148_mod_3	Britney Spears was born and raised in the midwest.	E
0	IA0	T1456	The orbital speed of Jupiter is less than 5 km/s.	C	T1456_mod_2	The orbital speed of Jupiter is less than 5 km/s.	E
0	IA0	T534	CIRCO HAD MORE THAN TWENTY FIVE VARIANTS	C	T534_mod_4	CIRCO HAD MORE THAN TWENTY FIVE VARIANTS	E
0	IA1	T1456	Jupiter has more than a dozen known satellites.	E	T1456_mod_3	Jupiter has more than a dozen known satellites.	C
0	IA1	T719	Cristiano Ronaldo is shorter than 6 feet tall.	C	T719_mod_2	Cristiano Ronaldo is shorter than 6 feet tall.	E
0	IA1	T1456	The inclination of Jupiter to the Sun's equator is greater than half a dozen degrees.	E	T1456_mod_4	The inclination of Jupiter to the Sun's equator is greater than half a dozen degrees.	C
0	IA0	T1503	Jim Belushi has had three wives.	E	T1503_mod_3	Jim Belushi has had three wives.	C
0	IA0	T719	Cristiano Ronaldo plays an offensive position rather than defensive.	E	T719_mod_3	Cristiano Ronaldo plays an offensive position rather than defensive.	C
0	IA1	T1503	Jim Belushi is an entertainer.	E	T1503_mod_4	Jim Belushi is an entertainer.	C
0	IA1	T719	Cristiano Ronaldo is a British Millenial.	C	T719_mod_4	Cristiano Ronaldo is a British Millenial.	E
0	IA0	T1550	J?rgen Skafte Rasmussen had the same nationality of where he was born.	E	T1550_mod_5	J?rgen Skafte Rasmussen had the same nationality of where he was born.	C
0	IA0	T1601	Jimmy Eat World has been making music for more than 25 years.	E	T1601_mod_3	Jimmy Eat World has been making music for more than 25 years.	C
0	IA0	T1601	Jimmy Eat World was started in the South Eastern part of the US.	C	T1601_mod_4	Jimmy Eat World was started in the South Eastern part of the US.	E
0	IA0	T1664	Jessie J has had an active career for over a decade.	E	T1664_mod_5	Jessie J has had an active career for over a decade.	C
0	IA1	T1791	Huddersfield Ben was alive for six years.	E	T1791_mod_4	Huddersfield Ben was alive for six years.	C
0	IA1	T1791	Huddersfield Ben was a Yorkshire Terrier.	E	T1791_mod_5	Huddersfield Ben was a Yorkshire Terrier.	C
0	IA1	T1918	Hypatia was born and died in Europe.	C	T1918_mod_2	Hypatia was born and died in Europe.	E
0	IA1	T14	Flatliners is pretty close to two hours long.	E	T14_mod_3	Flatliners is pretty close to two hours long.	C
0	IA0	T433	Concussion is an American film.	E	T433_mod_2	Concussion is an American film.	C
0	IA0	T536	Denver, Colorado was founded and incorporated within a decade of each other	C	T536_mod_1	Denver, Colorado was founded and incorporated within a decade of each other	E
0	IA1	T662	Detroit's urban area is bigger than the metro area.	C	T662_mod_1	Detroit's urban area is bigger than the metro area.	E
0	IA1	T749	The comic Crossed was published for under two years.	E	T749_mod_1	The comic Crossed was published for under two years.	C
0	IA0	T791	The fire in Club Colectiv suspects list contain at least one politician.	E	T791_mod_1	The fire in Club Colectiv suspects list contain at least one politician.	C
0	IA1	T1784	Interior is a 19th century work of art.	E	T1784_mod_2	Interior is a 19th century work of art.	C
0	IA0	T777	David Packouz never owned a business.	C	T777_mod_2	David Packouz never owned a business.	E
0	IA1	T1449	Kareem Abdul-Jabbar played basketball professionally in the same state he went to high school.	C	T1449_mod_1	Kareem Abdul-Jabbar played basketball professionally in the same state he went to high school.	E
0	IA1	T1406	Kazakh Khanate was disestablished at the turn of the 19th century.	E	T1406_mod_1	Kazakh Khanate was disestablished at the turn of the 19th century.	C
0	IA0	T536	Denver was founded by a local group of miners in 1848.	C	T536_mod_2	Denver was founded by a local group of miners in 1848.	E
0	IA0	T1456	The orbital period of Jupiter is more than 12 times as long as Earth's.	C	T1456_mod_5	The orbital period of Jupiter is more than 12 times as long as Earth's.	E
0	IA1	T885	Caracas' city is at sea level.	C	T885_mod_2	Caracas' city is at sea level.	E
0	IA0	T983	Camilla Rosemary Shand has had more marriages than children.	C	T983_mod_4	Camilla Rosemary Shand has had more marriages than children.	E
0	IA0	T440	Spanish is the national language in Santiago.	E	T440_mod_5	Spanish is the national language in Santiago.	C
0	IA0	T1544	Johnny Cash was in his seventies when he died.	E	T1544_mod_1	Johnny Cash was in his seventies when he died.	C
0	IA1	T1512	John McCain had his first political victory in the 90s.	E	T1512_mod_1	John McCain had his first political victory in the 90s.	C
0	IA0	T64	The Equestrian Portrait of Charles I was completed by Anthony van Dyck.	E	T64_mod_3	The Equestrian Portrait of Charles I was completed by Anthony van Dyck.	C
0	IA0	T544	Despicable Me 3 was a box office disappointment.	C	T544_mod_3	Despicable Me 3 was a box office disappointment.	E
0	IA0	T733	Coca-Cola with Lime/Diet Coke with Citrus Zest contained an actual wedge of lime.	C	T733_mod_2	Coca-Cola with Lime/Diet Coke with Citrus Zest contained an actual wedge of lime.	E
0	IA1	T947	There are more who practice the African traditional religion than the Christian religion in the Republic of Botswana.	C	T947_mod_5	There are more who practice the African traditional religion than the Christian religion in the Republic of Botswana.	E
0	IA0	T1508	Josta is a drink that was popular in the 1990s.	E	T1508_mod_3	Josta is a drink that was popular in the 1990s.	C
0	IA1	T1702	PepsiCo has stuck to its original formula for Kas with no changes.	C	T1702_mod_3	PepsiCo has stuck to its original formula for Kas with no changes.	E
0	IA1	T1412	Johnny the Homicidal Maniac came out once a month.	E	T1412_mod_2	Johnny the Homicidal Maniac came out once a month.	C
0	IA1	T1241	Atari 2600 was sold only domestically.	C	T1241_mod_1	Atari 2600 was sold only domestically.	E
0	IA1	T1010	Boy Peeling Fruit  is a mural painted on the ceiling of a church.	C	T1010_mod_2	Boy Peeling Fruit  is a mural painted on the ceiling of a church.	E
0	IA1	T554	Danehill is a famous racehorse from the United States.	E	T554_mod_3	Danehill is a famous racehorse from the United States.	C
0	IA1	T1847	Jack Antonoff has been performing for over twenty years.	C	T1847_mod_4	Jack Antonoff has been performing for over twenty years.	E
0	IA0	T787	The Republic of Cuba is a country located in the Northern Hemisphere.	E	T787_mod_5	The Republic of Cuba is a country located in the Northern Hemisphere.	C
0	IA1	T1545	Jim Mattis served over fifty years in the military.	C	T1545_mod_1	Jim Mattis served over fifty years in the military.	E
0	IA0	T1031	Case Closed was a long-running Japanese comic serial.	C	T1031_mod_1	Case Closed was a long-running Japanese comic serial.	E
0	IA0	T1788	Issa Album was a collaborative effort between multiple hip-hop producers.	E	T1788_mod_1	Issa Album was a collaborative effort between multiple hip-hop producers.	C
0	IA1	T680	Camp Kill Yourself has been signed to Universal and Paramount.	C	T680_mod_3	Camp Kill Yourself has been signed to Universal and Paramount.	E
0	IA0	T885	Caracas is a a capital city a few thousand feet above sea level.	E	T885_mod_3	Caracas is a a capital city a few thousand feet above sea level.	C
0	IA1	T2028	Working Title Films was made in German.	C	T2028_mod_2	Working Title Films was made in German.	E
0	IA0	T1942	Jacques Charles was known for his work in science.	E	T1942_mod_2	Jacques Charles was known for his work in science.	C
0	IA1	T1177	Norwegian Air Shuttle is focused out of Queens, New York.	E	T1177_mod_1	Norwegian Air Shuttle is focused out of Queens, New York.	C
0	IA1	T1449	Kareem Abdul-Jabbar played basketball for over four decades.	C	T1449_mod_2	Kareem Abdul-Jabbar played basketball for over four decades.	E
0	IA0	T899	Chengdu is a provincial city that sits around 1,600 feet in the air.	E	T899_mod_2	Chengdu is a provincial city that sits around 1,600 feet in the air.	C
0	IA0	T1861	Iceland got sovereignty in 1904.	E	T1861_mod_4	Iceland got sovereignty in 1904.	C
0	IA1	T413	Justus von Liebig studied and taught chemistry in their life.	E	T413_mod_4	Justus von Liebig studied and taught chemistry in their life.	C
0	IA1	T1017	Casablanca was edited and written by Humphrey Bogart.	C	T1017_mod_2	Casablanca was edited and written by Humphrey Bogart.	E
0	IA0	T1888	Huntington Beach, California has no city manager.	C	T1888_mod_3	Huntington Beach, California has no city manager.	E
0	IA1	T272	The musician Chet Baker primarily played Jazz music.	E	T272_mod_2	The musician Chet Baker primarily played Jazz music.	C
0	IA0	T1656	Karen Gillan is a performer in her late 30s.	C	T1656_mod_2	Karen Gillan is a performer in her late 30s.	E
0	IA0	T2028	Working Title Films was released in the United Kingdom before anywhere else.	E	T2028_mod_3	Working Title Films was released in the United Kingdom before anywhere else.	C
0	IA0	T839	DC Comics Presents was an American comic book series.	E	T839_mod_3	DC Comics Presents was an American comic book series.	C
0	IA1	T1390	Godolphin Racing has been the owner of Cape Cross since 1994.	C	T1390_mod_4	Godolphin Racing has been the owner of Cape Cross since 1994.	E
0	IA0	T688	Dennis Gabor is a famous Hungarian/British scientist.	E	T688_mod_2	Dennis Gabor is a famous Hungarian/British scientist.	C
0	IA1	T596	Ciara Princess Harris married  Nayvadious Wilburn	C	T596_mod_1	Ciara Princess Harris married  Nayvadious Wilburn	E
0	IA1	T12	The Faroe Islands are led by Lene Moyell Johnansen.	C	T12_mod_5	The Faroe Islands are led by Lene Moyell Johnansen.	E
0	IA1	T1179	Trainer of Brigadier Gerard is Mr & Mrs. John L. Hislop.	C	T1179_mod_2	Trainer of Brigadier Gerard is Mr & Mrs. John L. Hislop.	E
0	IA0	T340	Jennifer Love Hewitt has been singing professionally since she was a toddler.	C	T340_mod_2	Jennifer Love Hewitt has been singing professionally since she was a toddler.	E
0	IA0	T272	The musician Chet Baker started playing music professionally at 10 years old.	C	T272_mod_3	The musician Chet Baker started playing music professionally at 10 years old.	E
0	IA1	T940	Bruges is a xenophobic area with no wish for outside visitors.	C	T940_mod_4	Bruges is a xenophobic area with no wish for outside visitors.	E
0	IA1	T745	Men's 50 kilometre freestyle at the XXII Olympic Winter Games was held in America.	C	T745_mod_4	Men's 50 kilometre freestyle at the XXII Olympic Winter Games was held in America.	E
0	IA0	T1784	Interior was painted in the last fifty years.	C	T1784_mod_3	Interior was painted in the last fifty years.	E
0	IA1	T543	India v. Pakistan at Eden Gardens in 1999 drew more than India's total 2017 season.	C	T543_mod_1	India v. Pakistan at Eden Gardens in 1999 drew more than India's total 2017 season.	E
0	IA1	T104	E Street band is from the capital of New Jersey.	C	T104_mod_4	E Street band is from the capital of New Jersey.	E
0	IA1	T709	Crack-Up was primarily recorded in Washington state.	C	T709_mod_3	Crack-Up was primarily recorded in Washington state.	E
0	IA1	T792	David Ronald de Mey Warren is an Australian scientist from Melbourne.	E	T792_mod_1	David Ronald de Mey Warren is an Australian scientist from Melbourne.	C
0	IA1	T1395	National Rail began in Liverpool England.	E	T1395_mod_3	National Rail began in Liverpool England.	C
0	IA0	T277	Mar’a del Rosario Mercedes Pilar Mart’nez Molina Baeza began an active career in 1963.	E	T277_mod_1	Mar’a del Rosario Mercedes Pilar Mart’nez Molina Baeza began an active career in 1963.	C
0	IA0	T1446	Jennifer Aniston has been active since her early twenties.	C	T1446_mod_2	Jennifer Aniston has been active since her early twenties.	E
0	IA1	T274	Fawad Khan did a record with Jay Z that was very popular.	C	T274_mod_1	Fawad Khan did a record with Jay Z that was very popular.	E
0	IA0	T536	Denver City is located in the deep south region of the United States.	C	T536_mod_3	Denver City is located in the deep south region of the United States.	E
0	IA0	T2032	Jakarta is the where the government in Republic of Indonesia is.	E	T2032_mod_4	Jakarta is the where the government in Republic of Indonesia is.	C
0	IA0	T435	Children of Bodom went by a different name their first four years of performing.	E	T435_mod_1	Children of Bodom went by a different name their first four years of performing.	C
0	IA1	T1668	Jerusalem is close to two thirds Jewish in population.	E	T1668_mod_1	Jerusalem is close to two thirds Jewish in population.	C
0	IA1	T17	Bryce Dallas Howard has been acting for about 30 years.	E	T17_mod_1	Bryce Dallas Howard has been acting for about 30 years.	C
0	IA0	T777	David Packouz is a former arms dealer who was sentenced to house arrest in the United States.	E	T777_mod_3	David Packouz is a former arms dealer who was sentenced to house arrest in the United States.	C
0	IA0	T1688	John Cyril Porte served more than once in the military.	E	T1688_mod_3	John Cyril Porte served more than once in the military.	C
0	IA1	T203	Japan's House of Councillors is higher than the house of representatives.	E	T203_mod_4	Japan's House of Councillors is higher than the house of representatives.	C
0	IA0	T1164	Romanian Footballer of the Year has been awarded every year since 1966.	E	T1164_mod_4	Romanian Footballer of the Year has been awarded every year since 1966.	C
0	IA1	T1690	Jinder Mahal is a neophyte in the ring.	C	T1690_mod_3	Jinder Mahal is a neophyte in the ring.	E
0	IA1	T797	Cue Card is a race horse foaled in Great Britain.	E	T797_mod_4	Cue Card is a race horse foaled in Great Britain.	C
0	IA0	T104	The E Street Band broke up in 1999.	C	T104_mod_5	The E Street Band broke up in 1999.	E
0	IA1	T1545	Jim Mattis was the head of the Joint Chiefs of Staff.	C	T1545_mod_2	Jim Mattis was the head of the Joint Chiefs of Staff.	E
0	IA0	T408	Karen Gillan has been an actress since childhood.	C	T408_mod_4	Karen Gillan has been an actress since childhood.	E
0	IA1	T382	Jeff Hardy is a wrestler and a musician.	E	T382_mod_1	Jeff Hardy is a wrestler and a musician.	C
0	IA1	T982	Republic of Chile is on the west coast of South America.	E	T982_mod_1	Republic of Chile is on the west coast of South America.	C
0	IA0	T400	Jordan Peele began acting professionally at 23 years old.	E	T400_mod_1	Jordan Peele began acting professionally at 23 years old.	C
0	IA0	T688	Dennis Gabor was a 20th century Nobel Price winning Physicist..	E	T688_mod_3	Dennis Gabor was a 20th century Nobel Price winning Physicist..	C
0	IA0	T734	David Cook has never had a child with his spouse, Helen.	C	T734_mod_4	David Cook has never had a child with his spouse, Helen.	E
0	IA0	T1179	Brigadier Gerard has a perfect career win-loss record	C	T1179_mod_3	Brigadier Gerard has a perfect career win-loss record	E
0	IA1	T1212	Glacier National Park is in two counties near Columbia Falls.	E	T1212_mod_5	Glacier National Park is in two counties near Columbia Falls.	C
0	IA0	T372	Florence Lawrence died before her third husband.	C	T372_mod_2	Florence Lawrence died before her third husband.	E
0	IA0	T152	Jane Austen was buried in her home country.	E	T152_mod_4	Jane Austen was buried in her home country.	C
0	IA0	T1917	Republic of Iraq is USA territory	C	T1917_mod_1	Republic of Iraq is USA territory	E
0	IA0	T1464	John James Rickard Macleod was in his fifties when he died.	E	T1464_mod_2	John James Rickard Macleod was in his fifties when he died.	C
0	IA1	T1002	Catalonia have no voice or representational governance in place.	C	T1002_mod_3	Catalonia have no voice or representational governance in place.	E
0	IA1	T1861	Iceland has been inhabited for over a millenia.	E	T1861_mod_5	Iceland has been inhabited for over a millenia.	C
0	IA0	T382	Jeff Hardy first wrestled professionally in 1990.	C	T382_mod_2	Jeff Hardy first wrestled professionally in 1990.	E
0	IA1	T1659	Jungle was filmed on two continents.	E	T1659_mod_1	Jungle was filmed on two continents.	C
0	IA0	T1473	Jimson Weed is a 19th century work of art.	C	T1473_mod_2	Jimson Weed is a 19th century work of art.	E
0	IA1	T702	City of London is Roman land.	C	T702_mod_2	City of London is Roman land.	E
0	IA0	T749	Crossed is a post-apocalyptic series published after the turn of the century.	E	T749_mod_2	Crossed is a post-apocalyptic series published after the turn of the century.	C
0	IA0	T1614	John Paul Getty III was born in the early part of the 1900s.	C	T1614_mod_2	John Paul Getty III was born in the early part of the 1900s.	E
0	IA0	T1031	The same publisher of 'Case Closed' also provided the English translation.	C	T1031_mod_2	The same publisher of 'Case Closed' also provided the English translation.	E
0	IA1	T2028	Hot Fuzz was a multi-national film production	E	T2028_mod_4	Hot Fuzz was a multi-national film production	C
0	IA1	T1508	PepsiCo has never tried to make an energy soft drink.	C	T1508_mod_4	PepsiCo has never tried to make an energy soft drink.	E
0	IA0	T308	K?lm?n Tihanyi received his schooling in Italy.	C	T308_mod_1	K?lm?n Tihanyi received his schooling in Italy.	E
0	IA1	T413	Justus von Liebig was a European scientist.	E	T413_mod_5	Justus von Liebig was a European scientist.	C
0	IA1	T310	Christchurch is over 200 years old.	C	T310_mod_2	Christchurch is over 200 years old.	E
0	IA0	T778	Crystal Head Vodka was released in the USA.	E	T778_mod_1	Crystal Head Vodka was released in the USA.	C
0	IA1	T20	Flatbush Zombies are signed to RCA records.	C	T20_mod_5	Flatbush Zombies are signed to RCA records.	E
0	IA1	T733	Coca-Cola with Lime/Diet Coke with Citrus Zest is a British-American beverage.	E	T733_mod_3	Coca-Cola with Lime/Diet Coke with Citrus Zest is a British-American beverage.	C
0	IA1	T1404	Kaya Scodelario was born with a different last name.	E	T1404_mod_2	Kaya Scodelario was born with a different last name.	C
0	IA0	T581	Cracovia is a weak alcoholic drink	C	T581_mod_2	Cracovia is a weak alcoholic drink	E
0	IA0	T1614	John Paul Getty III was known for being taken away from his family.	E	T1614_mod_3	John Paul Getty III was known for being taken away from his family.	C
0	IA1	T846	Dean Martin has been active in the music industry for over 60 years.	C	T846_mod_1	Dean Martin has been active in the music industry for over 60 years.	E
0	IA1	T1177	John F. Kennedy International Airport is used solely for airplanes.	C	T1177_mod_2	John F. Kennedy International Airport is used solely for airplanes.	E
0	IA0	T1179	There was only one race that Brigadier Gerard ran that wasn't won by the horse.	E	T1179_mod_4	There was only one race that Brigadier Gerard ran that wasn't won by the horse.	C
0	IA0	T340	Jennifer Love Hewitt is an actress who had a singing career in Pop music.	E	T340_mod_3	Jennifer Love Hewitt is an actress who had a singing career in Pop music.	C
0	IA1	T940	Bruges has a single post code representing the entire city.	C	T940_mod_5	Bruges has a single post code representing the entire city.	E
0	IA0	T207	All Burn Energy drinks are sugar free.	C	T207_mod_4	All Burn Energy drinks are sugar free.	E
0	IA0	T1656	Karen Gillan is a female UK actress.	E	T1656_mod_3	Karen Gillan is a female UK actress.	C
0	IA1	T491	Cory Monteith was a Canadian entertainer that died less than a decade ago.	E	T491_mod_2	Cory Monteith was a Canadian entertainer that died less than a decade ago.	C
0	IA0	T17	Bryce Dallas Howard has been acting for more than 20 years.	E	T17_mod_2	Bryce Dallas Howard has been acting for more than 20 years.	C
0	IA0	T1918	Hypatia studied the teachings of well-known philosophers.	E	T1918_mod_3	Hypatia studied the teachings of well-known philosophers.	C
0	IA0	T829	Commonwealth of the Philippines was a independent Sovereign nation.	C	T829_mod_2	Commonwealth of the Philippines was a independent Sovereign nation.	E
0	IA1	T727	Dick Van Dyke is not yet a grandfather.	C	T727_mod_1	Dick Van Dyke is not yet a grandfather.	E
0	IA1	T382	Jeff Hardy began wrestling professionally when they were only 16 years old.	E	T382_mod_3	Jeff Hardy began wrestling professionally when they were only 16 years old.	C
0	IA1	T792	David Ronald de Mey Warren was a flight recorder since the early 1920's.	C	T792_mod_2	David Ronald de Mey Warren was a flight recorder since the early 1920's.	E
0	IA1	T403	John Harrison is an award-winning English Horologist.	E	T403_mod_5	John Harrison is an award-winning English Horologist.	C
0	IA0	T323	The Czech Republic was part of the European Union before independence.	C	T323_mod_2	The Czech Republic was part of the European Union before independence.	E
0	IA0	T286	Fan Bingbing is the head of their own Label.	E	T286_mod_3	Fan Bingbing is the head of their own Label.	C
0	IA1	T727	Dick Van Dyke is an actor and comedian from Malibu.	E	T727_mod_2	Dick Van Dyke is an actor and comedian from Malibu.	C
0	IA0	T1882	Jack of Fables was a monthly comic book series.	E	T1882_mod_2	Jack of Fables was a monthly comic book series.	C
0	IA1	T1503	Jim Belushi was active in his listed occupations in the early 1970's.	C	T1503_mod_5	Jim Belushi was active in his listed occupations in the early 1970's.	E
0	IA0	T1713	John Cho was born in the Summer of 1972.	E	T1713_mod_3	John Cho was born in the Summer of 1972.	C
0	IA1	T308	K?lm?n Tihanyi was an educated European.	E	T308_mod_2	K?lm?n Tihanyi was an educated European.	C
0	IA1	T816	The XXIII Olympic Winter Games took place in 2018.	E	T816_mod_2	The XXIII Olympic Winter Games took place in 2018.	C
0	IA1	T790	Cuba's War of Independence was waged nearly three decades after its Declaration of Independence.	E	T790_mod_3	Cuba's War of Independence was waged nearly three decades after its Declaration of Independence.	C
0	IA0	T458	Contract bridge is purely luck based.	C	T458_mod_3	Contract bridge is purely luck based.	E
0	IA0	T1656	Karen Gillan has been active since her twenties.	C	T1656_mod_4	Karen Gillan has been active since her twenties.	E
0	IA0	T1677	Johannes Gutenberg made it easier for people to print things.	E	T1677_mod_4	Johannes Gutenberg made it easier for people to print things.	C
0	IA0	T543	Cricket is an unpopular sport in India.	C	T543_mod_2	Cricket is an unpopular sport in India.	E
0	IA1	T839	DC Comics presents was ongoing comic series that ran over 100 issues while active.	E	T839_mod_4	DC Comics presents was ongoing comic series that ran over 100 issues while active.	C
0	IA1	T829	The Philippines have had a nation assembly government for their entire history.	C	T829_mod_3	The Philippines have had a nation assembly government for their entire history.	E
0	IA1	T261	There were monarchs in three different capitals in Jin's history..	E	T261_mod_3	There were monarchs in three different capitals in Jin's history..	C
0	IA0	T596	Ciara is an American R&B singer and dancer.	E	T596_mod_2	Ciara is an American R&B singer and dancer.	C
0	IA1	T974	The urban square mileage of Chicago is larger than the metro square mileage.	C	T974_mod_2	The urban square mileage of Chicago is larger than the metro square mileage.	E
0	IA1	T1464	John James Rickard Macleod, FRS was a British Nobel Prize winner.	E	T1464_mod_3	John James Rickard Macleod, FRS was a British Nobel Prize winner.	C
0	IA1	T361	Joaquin Rafael Bottom has been known as Leaf Phoenix.	E	T361_mod_3	Joaquin Rafael Bottom has been known as Leaf Phoenix.	C
0	IA0	T741	David Duchovny made his big screen debut at the age of 24.	C	T741_mod_3	David Duchovny made his big screen debut at the age of 24.	E
0	IA1	T1600	K?roly Zipernowsky was born in 19th century Vienna.	E	T1600_mod_1	K?roly Zipernowsky was born in 19th century Vienna.	C
0	IA0	T1017	Casablanca is a classic American Hollywood film.	E	T1017_mod_3	Casablanca is a classic American Hollywood film.	C
0	IA1	T1002	Catalonia is governed by elected officials and overseen by a monarchy.	E	T1002_mod_4	Catalonia is governed by elected officials and overseen by a monarchy.	C
0	IA0	T1241	Consoles with 128 bytes of RAM are not compatible with joysticks.	C	T1241_mod_2	Consoles with 128 bytes of RAM are not compatible with joysticks.	E
0	IA1	T1412	You can get a new issue of Johnny the Homicidal Maniac next month.	C	T1412_mod_3	You can get a new issue of Johnny the Homicidal Maniac next month.	E
0	IA1	T1791	Huddersfield Ben is a name for a mut.	C	T1791_mod_6	Huddersfield Ben is a name for a mut.	E
0	IA1	T581	Cracovia was originally a beer and transformed into 40 Proof Vodka.	C	T581_mod_3	Cracovia was originally a beer and transformed into 40 Proof Vodka.	E
0	IA0	T811	Collision Course is a multi-disc rap/rock mash up released in 2004.	E	T811_mod_1	Collision Course is a multi-disc rap/rock mash up released in 2004.	C
0	IA0	T310	Christchurch is located on the southern island of New Zealand.	E	T310_mod_3	Christchurch is located on the southern island of New Zealand.	C
0	IA1	T727	Dick Van Dyke's middle initial is found near the end of the English alphabet.	E	T727_mod_3	Dick Van Dyke's middle initial is found near the end of the English alphabet.	C
